
slug,title,meta_description,h1,keyword
cold-email-templates-agency,Cold Email Templates for Agencies,Ready-to-use email scripts for agencies to win clients.,Cold Email Templates for Agencies,cold email templates for agencies
subject-lines-saas,Subject Lines for SaaS Sales,Subject lines to increase demo replies for SaaS.,Subject Lines for SaaS Sales,subject lines saas
follow-up-after-no-response,Follow-up After No Response,Follow-up scripts to restart stalled conversations.,Follow-up After No Response,follow up email no response
partnership-pitch-creators,Partnership Pitch Emails for Creators,Collab outreach templates for creators and brands.,Partnership Pitch Emails for Creators,creator partnership email
local-biz-outreach-city,Local Business Outreach Templates ({{CITY}}),Scripts to book calls with local businesses.,Local Business Outreach Templates,local business outreach email
